<?xml version="1.0" encoding="UTF-8"?>
<!ELEMENT mappe(mappa *)>
<!ELEMENT mappa (nome, dimensione, descrizione, foto)>
<!ELEMENT nome(#PCDATA)>
<!ELEMENT descrizione(#PCDATA)>
<!ELEMENT foto(#PCDATA)>
